id,product_url,keyword,sort,img,title,price,seller,category,description,ai_info,ai_review,created_at,updated_at
32,https://www.kurly.com/goods/5081090?collectionCode=jangboginew,식품,32,https://product-image.kurly.com/hdims/resize/%5E%3E720x%3E936/cropcenter/720x936/quality/85/src/product/image/78ebd69e-1cc6-482c-b056-70f5da3f0022.jpg,[KF365] 양념 소불고기 2종 (택1),12990,-,정육가공육달걀,"호불호 없는 메인 요리를 꼽자면 양념 소불고기가 빠지지 않을 거예요. 달짝지근한 양념이 고루 밴 야들한 소불고기는 온 가족 밥반찬으로 딱 좋은 식재료인데요. 육가공 전문 브랜드, 견우푸드와 손 잡고 질 좋은 소고기에 너무 짜거나 달지 않은 은근한 감칠맛을 입혀 완성했답니다. 냉장고에 구비해두고 마땅한 반찬이 떠오르지 않는 순간, 언제든지 꺼내 즐겨보세요. 명절 음식으로 활용하기에도 제격일 거에요.",,,,
33,https://www.kurly.com/goods/1000120319?collectionCode=jangboginew,식품,33,https://product-image.kurly.com/hdims/resize/%5E%3E720x%3E936/cropcenter/720x936/quality/85/src/product/image/8bb1a803-92c6-4f13-b39c-5a942c339fe3.jpg,[KF365] 한돈 급냉 삼겹살 600g~ (냉동) ,12000,-,정육가공육달걀,"맛 좋은 우리 한돈을 부담 없이 즐겨보세요. 컬리는 구이용으로 먹기 좋게 손질한 급냉 삼겹살을 준비했어요. 너무 두껍지도, 얇지도 않은 두께라 해동 없이 그대로 구워 즐길 수 있고요. 삼겹살 특유의 육즙과 씹는 재미도 오롯이 느낄 수 있답니다. 냉동실에 든든히 챙겨 보세요.",,,,
34,https://www.kurly.com/goods/1000444603?collectionCode=jangboginew,식품,34,https://product-image.kurly.com/hdims/resize/%5E%3E720x%3E936/cropcenter/720x936/quality/85/src/product/image/f195b407-c724-4cd9-8fca-aa49d8437082.jpg,[고메공방] 계란빵 2종 (5개입) (택1),11250,-,베이커리,"입으로 후후 불어 맛보던 계란빵의 달달함과 고소함, 고메공방이 선보이는 계란빵으로 간편하게 즐겨보세요. 액상 계란이 아닌 진짜 계란을 한 알 한 알 깨서 넣은 덕에, 그 고소함이 더욱 짙어요. 계란 본연의 맛이 담긴 오리지널과 짭조름한 풍미가 매력적인 햄치즈를 준비했답니다. 한 개씩 개별 포장되어 있으니, 출출할 때마다 하나씩 꺼내 즐겨보세요. ",,,,
35,https://www.kurly.com/goods/1001143756?collectionCode=jangboginew,식품,35,https://product-image.kurly.com/hdims/resize/%5E%3E720x%3E936/cropcenter/720x936/quality/85/src/product/image/b68a03c3-0c72-4eaf-a5f3-281c4749c848.jpg,[골라담기] 오뚜기 라면 8종 균일가 (택3),3300,-,면양념오일,"일상과 떼려야 뗄 수 없는 식품을 꼽아보자면, 라면은 아마 다섯 손가락 안에는 들 거예요. 오랜 시간 꾸준히 사랑받아온 라면을, 부담스럽지 않은 용량으로 컬리에서 간편하게 만나 보세요. 다양한 종류의 인기 라면을 준비했으니 딱 필요한 만큼만 장바구니에 담아, 정석대로 또는 나만의 레시피로 응용해 즐겨 보세요.",,,,
36,https://www.kurly.com/goods/1001118076?collectionCode=jangboginew,식품,36,https://product-image.kurly.com/hdims/resize/%5E%3E720x%3E936/cropcenter/720x936/quality/85/src/product/image/0e55a2bf-4706-4868-ac3d-6a431d634d45.jpg,두툼 흑돼지 모아보기 10종 (택1),7492,-,정육가공육달걀,-,,,,
37,https://www.kurly.com/goods/1000750847?collectionCode=jangboginew,식품,37,https://product-image.kurly.com/hdims/resize/%5E%3E720x%3E936/cropcenter/720x936/quality/85/src/product/image/b7723fd5-1e2a-437b-be5f-61d3e8ca2c9f.jpg,[KF365] 항공직송 노르웨이 생연어 6종 (냉장) (택1),15900,-,수산해산건어물,"노르웨이 해역에서 어획해 항공직송으로 신선하게 들여온 KF365 생연어를 만나보세요. 촉촉한 주홍빛 속살에 고소하고 기름진 풍미가 일품이랍니다. 얼리지 않은 생연어라 더욱 부드럽고 신선하지요. 회부터 횟감, 필렛, 스테이크까지 다양하게 준비했으니 용도에 따라 자유롭게 선택해보세요. ",,,,
38,https://www.kurly.com/goods/1000417443?collectionCode=jangboginew,식품,38,https://product-image.kurly.com/hdims/resize/%5E%3E720x%3E936/cropcenter/720x936/quality/85/src/product/image/e6be4634-87e1-4b41-9ee8-0bad8c1e0a32.jpg,[KF365] 오리주물럭 600g (200gX3개입),15210,-,정육가공육달걀,"진한 감칠맛의 양념이 깊이 배어든 주물럭은 그 어떤 식탁에 내놓아도 호불호를 가리기 어렵죠. 그중에서도 매콤한 붉은 빛 양념의 오리 주물럭은 누구에게나 환영 받는 한 끼 식사예요. 오리고기 지방이 내는 고소한 기름이 진한 양념 맛에도 존재감을 잃지 않기 때문이에요. 컬리가 선보이는 KF365로 오리주물럭을 부담 없이 즐겨보세요. 국내산 오리고기에 고추장 양념을 꼼꼼히 버무렸답니다. 깔끔한 맛의 태양초 고추장에 물엿과 마늘, 양파를 듬뿍 넣어 감칠맛을 입혀낸 양념이에요. 냉장고에 구비해두고 마땅한 반찬이 떠오르지 않는 순간, 언제든지 꺼내 즐겨보세요.",,,,
39,https://www.kurly.com/goods/1000170410?collectionCode=jangboginew,식품,39,https://product-image.kurly.com/hdims/resize/%5E%3E720x%3E936/cropcenter/720x936/quality/85/src/product/image/cf707ac9-be01-4c38-9f61-8b78ef00538d.jpg,[KF365] 통통한 그릴 비엔나 소시지 700g,8900,-,정육가공육달걀,"비엔나 소시지의 가장 큰 매력은 한 입에 쏙 넣고 깨물면 톡 하고 터지는 식감일 거예요. 컬리는 이 매력을 오롯이 느낄 수 있도록, 입안 가득 꽉 차는 크기의 통통한 비엔나 소시지를 준비했답니다. 국산 돼지고기 함량이 94.36%에 달하니 풍성한 육즙과 육향은 말할 것도 없고요. 입자를 살려 갈았기에 쫄깃하게 씹히는 식감이 일품이에요. 넉넉한 양을 담았으니, 냉장고에 구비해 두고 두루두루 활용해 보세요. ",,,,
40,https://www.kurly.com/goods/1000858612?collectionCode=jangboginew,식품,40,https://product-image.kurly.com/hdims/resize/%5E%3E720x%3E936/cropcenter/720x936/quality/85/src/product/image/cc293040-0531-4b61-ae86-c5e63d1e1fa6.jpg,[KF365] 컷팅파인애플 1kg,12900,-,과일견과쌀,-,,,,
