id,product_id,review1,review2,review3
60,60,"아침대용으로 그릭요거트에 넣어먹어먹었어요~
껍질 질기지않고 뽀독뽀독 맛있어용^^",달고 알고 크고 맛있었어요. 부라타 샐러드 만들어 먹었어요,"학원을 운영중입니다. 이번 추석명절을 맞이하여 아끼는 학생들에게 기억에 남을 추억을 만들어 주고 싶은 마음에 선물을 고민하던 중, 제가 요즘 즐겨 먹고 있는 컬리의 샤인머스캣을 선물로 결정을 하게 되었습니다. 영양학을 전공한 사람으로서 과일의 영양학적 이로움을 항상 학생들한테 잔소리처럼 전달하고 있는데 이번기회에 명분있는 선물이 된것같고. 다가올 추석명절이 보름달처럼 풍성하길 바라는 마음을 샤인머스캣과 함께 담아 선물하게되었습니다. 아울러 합리적인 가격과 정성스런 포장 그리고 제일 중요한 맛은 제가 올 한해 먹어본 샤인머스캣 중에서 200% 입니다. 샤인머스캣은 당도가 있어도 껍질이 씹히면 품질이 떨어지는데 요즘 즐겨먹고 있는 제품은 검증이 되서 이또한 선물리스트에 우선순위였던 것 같습니다. 아무쪼록 좋은기회가 된 것 같아 좋은 품질의 과일을 선별해주신 컬리에게 감사를 드립니다. "
61,61,"통통하고 실하니 맛나요!
짜지 않아서 좋아요~

치킨 파우더로 초간단 “미나리 새우 원팬 파스타”

🍀 재료 (1인분)
파스타 스파게티니 80g(1인분), 미나리 한줌, 다진마늘 1/2큰술, 페페론치노 취향껏, 치킨 파우더 1/2큰술 또는 미원 약간, 새우 5~7개, 맛술 1큰술, 물 600ml

💁‍♀️ 만드는 방법
1. 미나리는 흐르는 물에 여러 번 헹구어 씻어주세요. 미나리가 잠길 정도의 찬물에 식초를 넣고 10분 정도 미나리를 담갔다가 한 번 더 찬물에 헹궈주세요. 줄기 밑동 부분을 제거한 후, 줄기 부분과 잎부분을 나눠 쫑쫑쫑 썰어두세요.(tip. 미나리는 시든 잎을 떼어내고 찬물로 여러번 헹구어 깨끗하 게 씻어주세요)
2. 손질한 새우는 세척 후 물기를 제거하고 맛술 1큰술 넣어 섞어주세요.
3. 예열한 팬에 올리브오일을 넉넉히 두르고 약불에서 마늘을 볶아주세요.
4. 마늘이 노릇노릇 익으면 스파게티 면과 치킨스톡, 새우를 넣고, 물은 면이 잠기는 정도까지만 붓고 중간강불에서 끓여주세요.(8분 정도)
5. 전분이 나오면서 수분이 중간정도 졸아들면 페퍼론치노를 취향껏 넣고 면을 익혀주세요.* 물이 부족하면 조금씩 추가해주세요.
6. 면이 익으면 최고 약한 불로 줄이고 미나리를 넣어 섞어가며 소스를 졸여주세요.
7. 불을 끄고 치즈 가루를 뿌려줍니다.* 쫑쫑 썬 미나리는 고명용으로 조금 남겨두세요.
8. 그릇에 면을 담고 남은 소스를 부어주고 미나리를 고명으로 얹으면 완성입니다.","유튜브에 유명한 인생 새우파스타 해먹으려고 구매했어요! 그리고 사실 이 제품은 냉동실에 넣어두면 든든한 제품이죠! 큼직하고, 녹여도 잡내가 안나서 맘에 들어요 레시피 소개해보겠습니다.

❶ 냉동 새우 5개 물에 넣어 해동 해줘요
❷ 방울토마토 7개 정도, 마늘 6알 손질해 준비해주어요!
❸ 올리브 오일에 편마늘과 페페론치노 넣어 구워줍니다!
❹ 애호박과 새우도 넣어서 잘 익혀주어요! 이때 소금간 살짝-
❺ 방울토마토 넣어 즙이 나오게끔 잘 으깨줘요!
❻ 삶아둔 면과 면수 약간 넣고 잘 볶아주고요
❼ 참치액 1스푼과 루꼴라 넣어주고 좀만 더 볶아주면 돼요! 
❽ 접시에 담아낸 후 레몬즙도 한 스푼! 뿌려주면 풍미가 더 좋아져요 생략 가능합니다!","손질되어 있는 생새우살 냉동실에 냉동보관해두었다가 꺼내서 해동해서 먹으면 되어서 잘 쟁여두고선 요리할때 사용해서 먹고 있어요! 탱글탱글한 새우 크기도 적당하고 씹히는 식감도 좋고 고소하고 맛있어요~~ 파스타해먹거나 감바스할때 해물요리로 더할때 넣어서 해먹고 있는데 잘활용해요! 감바스 요리에 새우토마토감바스로 해먹었는데 맛있어서 같이 레시피 공유해봅니다!
* 새우토마토감바스 레시피
1. 냉동새우를 해동해서 준비해주고요.
2. 마늘을 편마늘로 썰어주고 토마토한개를 적당한 크기로 잘라요
3. 올리브오일 넉넉하게 두른 팬에 편마늘을 노릇노릇하게 굽고요
4. 해동된 새우를 넣고 익혀주세요
5. 새우가 익을때 즈음에 토마토를 넣어 익히고 올리브도 넣어 같이 잘 끓여요~
6. 후추소금 갈아서 간조절해주고요
7. 그 위에 구운 바게트빵을 올려서 맛있게 냠냠
새우토마토감바스 바게트에 올려서 먹으니 잘어울리구 맥주안주로도 좋아요! 파스타를 좋아한다면 여기에 파스타면을 삶아서 넣으면 오일파스타로 딱입니다~~"
62,62,"간단하면서도 맛있는 거 없나.. 하고 장보던 중 발견한 '꼬막비빔장'
연안식당 가보진 않았는데 주변에서 맛있다는 말을 종종 들었어서 믿고 주문해봤어요 . ᐟ. ᐟ

1통에 150g이지만 (?) 두 명이서 먹을 거라 2통 구매했고 할인쿠폰 받아서 저렴하게 샀어요
냉동제품이라 먹기 전날 미리 냉장고로 옮겨 해동해 줬습니다 'ᴗ'

뭐.. 요리라 할 것도 없이 그냥 그릇에 먹을 만큼 담아서 계란후라이+김만 꺼냈더니 한상 뚝딱 차려졌어요ㅋㅋ
진짜 요리하기 귀찮은 날 먹기 딱 좋아요

양은 생각보다 꼬막이 많이 들어가 있더라고요?
한끼에 끝내버린다면 끝낼 수 있지만 두끼로 나눠드셔도 충분한 양 . ᐟ. ᐟ

개인적으로 밥에 뭐 비벼 먹는 걸 좋아하지 않아서 따로 먹었는데 맛있었어요
참기름 향에 부추까지 살짝 매콤한데 냄새도 안 나고 통통한 것이 가격 대비 너무 괜찮더라고요 ❥

다만 조금 짠 편..이라서 밥 많이 드셔야 할 거예요 ᐪ ᐪ
원래 짜게 먹는 편인 저한테는 먹다 보니 짜게 느껴졌어요
동거인은 안짜다고하는 거 보니 역시 개인마다 차이가 있을 수 있다는 점 참고해주세요

그래도 맛은 굳 ദ്ദി
다음에 꼬막 비빔장 먹고 싶으면 재구매해야겠습니다","부담없이 아무렇게나 밥에 쓱쓱 진짜 너무 너무 맛있어요 연안식당 워낙에 유명하잖아요 이렇게 소포장으로 나왔는데 양념장도 정말 듬뿍이고 새벽배송으로 빠르게 잘 받아서 진짜 너무 너무 맛있게 잘 먹었습니다 감동의 맛이네요 ㅎㅎ 파스타나 두부구이위에 올려도 활용해서 먹기 좋을 것 같아요 양념장이 진짜 너무 너무 별미입니다 ㅠㅠ 특별한 반찬 진짜 다 필요없고 밥에 쓱쓱하면 끝이니,  진짜 너무 일품이네요 양념장맛도 별미인데 쫄깃 부드러운 고소한 꼬막도 진짜 너무 맛있어요 꼬막 손질해서 직접 쪄먹으려면 진짜 완전 노동이거든요 이렇게 다 세척 및 너무 깔끔하게 위생포장까지 손질 다 되어 있고 진짜 개봉해서 바로먹는 편리함 너무 너무 좋아요 진짜 너무 맛있어서 하루만에 다 먹었어요..ㅋㅋㅋ 부추도 풍성하고 들어있어서 또 주문하려구요 ㅠㅠ 짱맛입니다","와 너무 맛있게 잘 먹었어요
참기름+김가루 조합으로 먹으니 진짜 대존맛입니다
몇몇 비리다는 후기가 있어 걱정했는데 전혀 비리지않고 냄새 나지 않아요

냉동상태로 와서 냉장고에 몇시간 냉장 해동 후 먹었는데 해동도 빠르게 잘 되네요

이것만 비벼 먹는다면 2인으로 적당할 거 같고 다른 반찬과 같이 먹는다면 3인이 먹기에도 양 괜찮을 거 같아요

가게에서 한 번 먹어봤고 컬리 베스트템 보다가 평이 좋길래 주문해본건데 가격도 착하고 양도 착하고 맛도 좋고 정말 만족해요

진짜 밥도둑이고 맛있게 한끼 뚝딱했습니다 매일 똑같은 반찬만 먹어 질렸는데 이렇게 별미로 한 번씩 먹어주는거 넘 추천합니다"
63,63,"진미채는 제 최애 반찬인데 너무 짜고 달아서 사 먹지는 못하겠더라구요. 사실 진미채는 브랜드 별로 생각 안하고 그때그때 할인되는거 주문했었는데 앞으로는 바다해 쫄깃 진미채 찾아서 주문할 것 같아요. 저는 채에 받혀서 흐르는 물로 한 번 씻고, 긴 것만 골라서 손으로 적당히 잘라줍니다. 사실 바다해 진미채는 크기가 한입 먹기에 딱 좋아서 잘라낼 만한 것이 많지 않았어요. 5개 정도? 진미채 반 100g 정도 사용했고, 씻어 둔 진미채에 적당히 물기가 스며드는 동안 고추장 반 스푼, 마요네즈 반 스푼, 알룰로스 반 스푼 미리 섞어 놓았습니다. 달구어진 팬에 올리브오일 한 바퀴 두르고 물결무늬 생기면 불을 꺼요. 그리고 섞어둔 양념을 부으면 보글보글합니다. 열기가 조금 식으면 진미채 넣어서 양념을 그냥 무치듯이 팬 위에서 섞어줍니다. 그럼 촉촉하고 오래 두어도 딱딱하지 않으면서 맛난 진미채볶음이 완성됩니다.","저 웬만하면 리뷰 안 남길라 하는뎈ㅋㅋ…
진심 너무 너무 질이 너무 좋아요..
진미채는 제가 좋아하는 거라 산거구..
엄마 치아가 안 좋으셔서 (어금니 윗니 아랫니가 거의 없으세요) 그래서 뭐든 잘게 잘라서 드시는데
보통 오징어류, 진미채 이런 건 시도도 안 하시다가 드셔보시고 괜찮으시다고 잘게 잘라 드시는데
사실은 양념 하기 전에 진미채가 부드러워서 좀 드셨다는 게 뿌듯했어요 히ㅣ히ㅣ
진짜 또 사러 올게유!!!","배송 빠르게 와서 좋았어요.
반찬으로 뭐할까 하다가 진미채볶음 선택!
진미채 자체가 쫄깃 쪼올깃~ღ 씹는 맛이 남다릅니다.
그냥 먹어도 맛있네요.
양념 해서 먹었는데 꾸르맛
밥 한번 먹고 진미채 먹으면 짱짱 맛있음
신선한게 너무 맛있어요
양도 은근 많구요!!!
잘산거 같습니다.
다음에 또 여기서 살게요!!! 재구매 각!ˆ̑՝̮ˆ̑❤︎
완전 만족합니당"
64,64,"제가 받은 제품은 170g 고등어예요.

큰 가시 하나에 옆에 몇 개 정도 가시가 있었고
거의  순살이나 다름없을 정도로 잘 정리되고 손질되어 있어서 얼마나 편한지요.

현미유 조금 넣어서 달군 후라이팬에 
살짝 헹군 고등어 한 손 올리고 앞 뒤로 잘 뒤집어가며 구워주면 간단히 완성되는 생선구이


두툼해서 살도 많고 먹을 게 많았어요.
개봉해보니 색깔도 선명하고 신선함이 느껴지더라구요. 살도 탱글했구요.

맛있게 2끼 잘 먹었어요.
살이 실하고 탱탱해서 식감도 맛도 좋은 노르웨이 고등어
처음 구매해봤는데 만족스러워서 재구매하고 싶어요.

비린내 없이 깔끔하고 두툼한 살밥 많은 고등어라 맛있게 잘 먹었어요.","생선 반찬은 거의 매일 단백질 보충용으로 식탁에 올리고 있습니다.
고등어 갈치 조기 번갈아 가며 굽는데
한번은 국내산 고등어로 샀더니 식구들이 덜 맛있다고 하더라구요.
컬리에서 여러 고객들이 입증한 제품이라 믿고 주문했습니다.
아이스박스에 드라이아이스 두팩 포함되어 꽁꽁 언 상태로 잘 받았습니다.
투명 포장이 전혀 없어 그렇긴 하지만 하얀 포장지 깔끔하고 이뻐요.
한팩씩 뜯기 좋게 절취선 들어 있구요.
껍질부터 올려 기름두르고 노릇하게 구워서 맛있게 먹고 있어요.
소금간 안 된거라 식구들 입맛대로 구울때 소금 솔솔 뿌려 간 맞추면 좋구요.
간이 안 되어 고등어 조림용으로 사용해도 좋을거 같습니다.
맛있어서 이건 너무 순식간에 다 먹게 된다는게 함정이네요.
냉동실 쟁임템 노르웨이 고등어입니다.","🥰  한평생 고등어 구이를 못먹는 음식이라고 생각했던 제가  
고등어 구이를 먹을 수 있게 된걸 넘어서서 좋아하게 된 유일한 제품입니다 

진짜 신기하죠?
간증 들어갑니다~

👍 일단 이 제품을 비린내 안나게 굽는 꿀팁은 
1. 고등어를 한번 물로 깨끗하게 씻고
2. 키친타올로 물기를 싹 닦아주고 
3. 앞뒤로 밀가루를 한번 묻혀주고 굽는 것입니다 

저는 비린걸 못먹는데 이거는 우적우적 먹는걸로 봐선 굽는 방법이 괜찮은가 봅니다 🤣 

💕 이 제품의 장점
1. 가시가 없다. (간혹 3~4개씩 나오는데 이정도면 없는 수준이라고 생각)
2. 오동통하고 튼실하다 살이 많다
3. 적당히 기름지고 촉촉해서 맛이 좋다
4. 단백질과 오메가3 섭취가 된다

🎁 저는 이 제품을 선물까지 해봤는데, 백화점에서 파는 고등어만큼 맛있다는 이야기를 들었어요 ^^

혹시 고민하시는 분들은 꼭 꼭 드셔보세요 
추천합니다 🐟🐟🐟 "
65,65,"평소  직접  팬에 구운 김을
식탁에 올리는 편인데,
더러더러 간편하게 먹고 싶을 때가 있어요.

다시마와 한알 육수와 무로
끓인 국물에 새우봉 어묵과
툭툭 자른 감자를 넣어
펄펄  끓인 어묵감자탕에
갓 지은 햅쌀밥과 김치,
그리고
만전김.

맨 입에 김 한장을 먼저 먹어봅니다 .
바삭바삭하면서 
감칠 맛이 있어 다시
밥 한술 얹어서  먹어요.

원스 어픈 어 타임--
한참 위의 시누이형님.
9남매중의 맏이인
의사 남편의 병원 살림을
건사하랴 
아들만 셋에 시어머님까지.
형제들 중에 가장 갸날픈
몸매로 그 큰 살림을 꾸리는 터라
늘 종종거리는데
언젠가 시댁에 가니
시누이가 방문하여 담소중
집에 오르는 어귀에 김을 구워 파는 가게가 생겨서 가끔씩
거기 김을 사서 식탁에 올리는데
남편이 알면 안된답니다 
직접 구운 김만 먹는다고. 에효..

완전 가부장이던 그 남편분은
돌아가신지 한참 전...

조촐한 밥상앞에 홀로 앉아
만전 구운 김으로 밥 한술 싸먹으면서
옛 생각에 젖어봅니다 .","👉 담백하고 고소한 맛, 낱개 포장까지 완벽한 만전김! 매일 밥반찬으로 찰떡이에요 :)

컬리에서 처음 주문해본 만전김, 기대 이상으로 만족스러웠어요!
정말 바삭하고 고소한 맛이 살아 있어요.
기름이나 소금이 과하지 않아서 느끼하지 않고 깔끔한 맛이라 밥이랑 먹기 너무 좋았어요.
무엇보다  낱개 포장되어 있어서 보관도 편하고, 도시락 싸거나 간식으로 챙기기 딱이에요.
저는 갓 지은 밥에 참기름 조금 넣고 이 김으로 싸 먹었는데, 그야말로 꿀맛…

김 특유의 비린내도 없고, 고소한 풍미가 오래 남아서 자꾸 손이 가더라고요.
아이부터 어른까지 다 잘 먹을 맛이라 재구매 100% 확정이에요!","⭐⭐⭐⭐⭐밥도둑이 따로 없어요! 컬리 갓구운 만전김  평소 김을 좋아하는 편이라 도시락김을 구매해봤는데, 기대 이상으로 맛있어서 매번 식사 때마다 찾을 것 같아요. 하나씩 개별 포장된 덕분에 간편하게 먹을 수 있고, 신선함이 그대로 유지되어서 정말 만족스러워요.

1. 바삭한 식감과 깊은 맛
첫 봉지를 뜯자마자 바삭하고 고소한 향이 퍼져서 정말 기분 좋았어요. 일반 시판 김들 중에는 눅눅하거나 기름이 과하게 느껴지는 경우가 많은데, 이 김은 기름기가 적당하고 바삭한 식감이 아주 일품이에요. 특히 짠맛이 강하지 않고 은은해서 밥이랑 먹기 딱 좋았습니다. 염도가 적당해 어린아이들부터 어른들까지 모두 좋아할 맛이에요.

2. 신선한 개별 포장과 편리함
 개별 포장되어 있어서 보관도 간편하고, 식사 때마다 하나씩 꺼내 먹기 좋아요. 특히 도시락이나 외출 시 챙겨 나가기에도 편리하고, 남은 김이 눅눅해질 걱정이 없으니 정말 좋더라고요. 깔끔하게 밀봉되어 있어 김 특유의 바삭함과 신선함이 오래 유지되는 느낌이었어요.

3. 다양한 활용도
밥과 함께 먹어도 좋고, 간단히 주먹밥이나 김밥을 싸 먹기에도 적당한 크기라 활용도가 높아요. 종종 야식으로 밥에 참기름 조금 넣고 이 김이랑 먹는데, 그 자체로 정말 훌륭한 간식이 됩니다. 간혹 밖에 나가기 힘들어 술안주로도 합격입니다.

4. 건강한 재료와 안심되는 맛
 이 김도 원초가 고급스럽고, 합성첨가물 없이 깨끗하게 구워져서 믿고 먹을 수 있었어요. 기름도 깔끔하게 발라져 있고, 튀지 않은 담백한 맛이라 계속 손이 가더라고요. 특히 기름기가 과하지 않아서 손에 많이 묻어나지 않는 것도 만족스러웠습니다.

총평
컬리 갓구운 만전김은 정말 만족스러운 선택이었어요. 매번 질리지 않고 맛있게 먹을 수 있고, 간편하게 챙길 수 있어 식사 준비가 한결 수월해졌습니다. 앞으로도 계속 재구매 의사 100%입니다! 고민 중이신 분들은 꼭 한번 드셔 보세요. 만족하실 거예요!

“도움이 돼요” 버튼 꾹 눌러주시면 힘이 됩니다!"
66,66,"마켓컬리에서 주문한 연어는 신선하고 잡내 없이 깔끔해서 집에서도 고급스러운 연어덮밥을 만들 수 있어요. 기름기가 적당히 올라와 부드럽고 촉촉한 식감이 인상적이었고, 함께 곁들인 소미시오다래 소스는 상큼하면서도 은은한 단맛과 감칠맛이 조화를 이루어 샐러드를 완벽하게 해줘요. 집밥이지만 외식 못지않은 맛과 멋을 만족만족. 양배추샐러드 소스는 고소하면서도 새콤달콤한 맛이 양배추 특유의 풋내를 잡아주고 아삭한 식감과 잘 어우러져 부담 없이 계속 먹게 되는 맛이었습니다. 전체적으로 간편하면서도 맛의 퀄리티가 높아 재구매 의사 충분하며, 바쁜 날에도 간단히 근사한 한 끼를 즐길 수 있어 만족!! 역시 컬리뿐이예요!!!","연어로 점심,저녁까지 해결!
점심에는 차지키 소스 만들어서 연어 넣어서 연어샌드위치 해먹고, 저녁은 연어 넣어서 연어롤(연어김밥) 만들어 먹었어요. 

연어 자체가 신선하고 비린내 없어서 익히지 않고 그냥 먹어도 깔끔하게 맛있어요. 
그래서 샌드위치, 김밥에 넣어도 다른 재료들과 잘 어울리면서 맛이 좋더라구요. 
소식좌 식구들에게는 적당한 양이라서 과하지도 부족하지도 않고 딱 좋았어요. 
이제 아이들이 안사먹어도 되겠다고 좋아하더라구요.
다음에도 구매해서 다양하게 요리해서 먹어보려구요. 

그리고 간장, 와사비도 소량씩 들어있어서 곁들여 먹을 수 있어서 그 점도 참 만족스럽고 좋았어요. ","제가 원래 생연어 느끼하고 비려서 잘 못먹는데요 이 생연어는  너무 신선하고 보들보들하니 사르르 입안에서 녹아요👍👍
연어초밥
1.흰밥에 단촛물을 세바퀴에서 네바퀴정도 넣고 참기름은 두바퀴정도 넣고 밥알들이 흩어질때까지 저어줍니다.
2.양파는 얇게 채썰어 찬물에 10분정도 담갔다가 건져주세요.
3.이제 밥을 동글하게 만들어주고 와사비 발라주고 연어로 감싸주고 그 위에 홀스래디쉬 소스를 반수저 얹고 양파 올리고 케이퍼 올리면 마무리 ㅎㅎㅎ

연어 세비체
1.이쁜 그릇에 연어 세개정도 펴서 올리고 올리브오일 뿌려준다
2.래디쉬,채썬 양파,케이퍼로 장식하고 라임 뿌리고 통후추 갈아서 뿌리고 건바질가루 뿌려주면 마무리됩니다.참 간단하죠?😅"
67,67,"캠핑 갔을 때 바베큐하려고 가져갔다가 엄청 잘먹었어요! 확실히 가을 대하철이라 새우가 달달하니 아주 맛이 좋더라고요.
냉동이 아닌 점이 마음에 들었고, 생물이라 캠핑 당일 새벽에 받아볼 수 있도록 주문해 컬리 퍼플박스에 잘 넣어갔습니다.

500g 기준 손바닥 길이만한 사이즈의 대하가 15개정도 들었어요.

별도의 양념없이 물로 한번 헹궈서 바로 숯불 위에 올렸는데 간이 딱 맞았습니다. 적절히 짭짤하면서도 새우 자체가 또 달달해서 그냥 먹어도 맛있더라고요.
캠핑가면서 이것저것 챙겨가기 힘든데 소금구이로 안해도 그냥 맛있는 새우라 너무 잘 먹었어요.ㅎ 

집에서 먹는다면 그냥 쪄먹어도 간편하게 먹을 수 있을 것 같아요!
여유가 되신다면 간은 이미 맞으니 소금구이보단 버터구이로 해드시면 더 맛있게 즐길 수 있을 것 같아요! ","저희가족은 대하를 엄청좋아합니다~
그래서 요즘 대하철이기도 해서 컬리에서 
적당한양에 가격도 착한 대하를 구매했어요

우선 깔끔한 플라스틱진공팩에 싱싱하고 크기도
큰 대하가 들어있어요~ 갯수는 18개정도이고
만지면 생물대하인걸 느낄수있을정도로
탱탱합니다^^♡
저희는 삼겹살에 대하를 넣어 따로 간을하지 않고
구워먹었어요. 고기기름이 새우를 더 노릇노릇하게 구워줍니다.  앞뒤로 주황빛을 띄기시작하면
5분정도 더 구워준다음 맛있게 먹습니다~
대하는 어른들도 좋아하지만 질긴 고기를 잘 못먹는
아들도 대하의 살이 탱탱하고 질기지않아 잘 먹네요!

500그람이 순식간에 사라집니다ㅜㅜ
저는 머리는 따로 남겨두어 라면을 끊일때
넣어줍니다. 그러면 국물의 감칠맛을 
느낄 수 있습니다.
아들이 대하를 너무 맛있게 잘먹어서 
만족스런 구매였어요!!!
담엔 1키로로 구매해야겠어요","급 감바스가 땡겨서 새우를 주문했습니다.

냉동새우로 해도 되지만 요즘 새우가 제철이기도 하고 생새우 감바스가 더 맛있지 않을까싶어 찾아보니 컬리에 딱 있지 뭐예요. 그래서 바로 주문했습니다.

아침에 주문했는데 그 날 밤에 바로 배송왔어요. 이 무더위에 이중 포장으로 배송와서 신선!싱싱!한 새우를 받을 수 있어서 너무 좋아요. 언박싱하니 큼직하고 싱싱한 새우가 열몇마리 이쁘게 있네요. 

수염이랑 머리 삼각뿔? 자르고 껍질 벗기고 생새우 손질하는데 약간의 노력이 필요하지만 맛있는 감바스가 기다리고 있는데 조금도 힘들지 않습니다.

집에 있는 야채 몇가지랑 올리브유 듬뿍 마늘 한가득 넣고 손질한새우 퐁당하면 끝~ 새우머리도 함께 넣었어요. 요 새우머리가 별미 였다는.

역시 생새우로 요리해서 그런지 풍미가 풍미가 기가 막힙니다. 바게트가 없어서 모닝빵으로 찍어 먹고 애들은 스파게티이랑 줬습니다. 아이들이 새우가 너무 맛있다고 쌍엄지척을 날려주네요.

늦게 퇴근하는 남편이 자긴껀 없냐고 투덜거려 주말에 새우 또 주문해서 요리해줘야겠어요^^"
